{
  "schema_version": "1.3",
  "generated_at": "2026-09-13T17:44:48.714078+00:00",
  "state": "stale",
  "stale": true,
  "stale_after_seconds": 691200,
  "message": "No terminal watch receipt is recent enough. Feed silence is not evidence of no change.",
  "last_attempted_run": {
    "run_id": "072bc26bf44247b5af57af754b6ad5d2",
    "state": "failed",
    "started_at": "2026-08-29T17:00:52.463546+00:00",
    "completed_at": "2026-08-29T17:00:52.466137+00:00",
    "as_of": "2026-08-29",
    "scope": "all jurisdictions",
    "registry_version": "1.0",
    "registry_revision": "b2b50258165aa3c4b5b040a3f6a4dbe40b319aece97d50e6d3bfea67280432b6",
    "eligible_source_ids": [],
    "attempted_source_ids": [],
    "successful_source_ids": [],
    "unmeasured_source_ids": [],
    "compared_source_ids": [],
    "eligible_count": 0,
    "attempted_count": 0,
    "successful_retrieval_count": 0,
    "unmeasured_count": 0,
    "observed_source_count": 0,
    "compared_source_count": 0,
    "attempt_completeness": null,
    "observation_count": 0,
    "has_internal_error": true
  },
  "last_successful_run": null
}
